{
  "$schema": "https://json-schema.org/draft/2020-12/schema",
  "$id": "https://github.com/your-org/research-wiki/schemas/export_manifest.schema.json",
  "title": "ExportManifest",
  "description": "literature-kb/06_Exports/<pack>/export_manifest.json. Mirrors lgrlw.schemas.ExportManifest.",
  "type": "object",
  "additionalProperties": false,
  "required": [
    "schema_version", "tool_version",
    "workspace_id", "exported_at",
    "kb_root_relative", "pack_dir_relative",
    "paper_ids", "files"
  ],
  "properties": {
    "schema_version":     {"const": "1.0.0"},
    "tool_version":       {"type": "string"},
    "workspace_id":       {"type": "string"},
    "exported_at":        {"type": "string", "pattern": "^\\d{4}-\\d{2}-\\d{2}T\\d{2}:\\d{2}:\\d{2}Z$"},
    "kb_root_relative":   {"type": "string", "pattern": "^(?!/)(?![A-Za-z]:)(?!.*\\\\)(?!.*(?:^|/)\\.\\.(?:/|$))(?!.*(?:^|/)\\.(?:/|$))[^/]+(?:/[^/]+)*$"},
    "pack_dir_relative":  {"type": "string", "pattern": "^(?!/)(?![A-Za-z]:)(?!.*\\\\)(?!.*(?:^|/)\\.\\.(?:/|$))(?!.*(?:^|/)\\.(?:/|$))[^/]+(?:/[^/]+)*$"},
    "paper_ids":          {"type": "array", "items": {"type": "string"}},
    "files": {
      "type": "object",
      "propertyNames": {"pattern": "^(?!/)(?![A-Za-z]:)(?!.*\\\\)(?!.*(?:^|/)\\.\\.(?:/|$))(?!.*(?:^|/)\\.(?:/|$))[^/]+(?:/[^/]+)*$"},
      "additionalProperties": {"type": "string", "pattern": "^[0-9a-f]{64}$"}
    }
  }
}
